{
  "schema_version": "1.0.0", "record_id": "synthetic-publication:printed-3", "source_publication_id": "synthetic-publication", "source_language": "ja", "target_language": "en", "record_type": "bounded_region", "page_type": "harness_layout", "record_status": "working",
  "primary_evidence": {"source_publication_id": "synthetic-publication", "artifact_fingerprint": "sha256:2222222222222222222222222222222222222222222222222222222222222222", "source_location": {"printed_page": "3", "region_id": "label-region"}, "source_location_review_status": "unreviewed"},
  "coverage": {"kind": "selected_regions", "boundary_description": "One synthetic diagram label.", "translated_region_ids": ["label-region"], "excluded_regions": [], "unreadable_regions": [], "omitted_content": []},
  "content_units": [{"unit_id": "label-1", "content_kind": "diagram_label", "source_region_id": "label-region", "source_transcription": {"status": "exact", "text": "試験番号"}, "literal_translation": {"status": "present", "text": "test number"}, "reviews": {"proposal": {"status": "proposed", "review_scope": "Label.", "process_description": "Synthetic."}, "source_reading": {"status": "unreviewed", "review_scope": "Label.", "process_description": "Not reviewed."}, "literal_translation": {"status": "unreviewed", "review_scope": "Label.", "process_description": "Not reviewed."}, "engineering_terminology": {"status": "unreviewed", "review_scope": "Label.", "process_description": "Not reviewed."}}}],
  "interpretive_dependencies": [{"dependency_id": "source-convention-1", "source_publication_id": "synthetic-publication", "source_location": {"printed_page": "i", "section": "Synthetic numbering convention"}, "role": "same_publication_interpretive_dependency", "material_convention": "Defines how the synthetic label number is read.", "affected_content_unit_ids": ["label-1"]}],
  "reviews": {"proposal": {"status": "proposed", "review_scope": "Label region.", "process_description": "Synthetic."}, "source_reading": {"status": "unreviewed", "review_scope": "Label region.", "process_description": "Not reviewed."}, "literal_translation": {"status": "unreviewed", "review_scope": "Label region.", "process_description": "Not reviewed."}, "engineering_terminology": {"status": "unreviewed", "review_scope": "Label region.", "process_description": "Not reviewed."}}
}
